{"algorithm":"reproassert-v02-instance-candidate-evaluation-v1","benchmark_version":"0.2","candidate":{"bytes":326,"relative_path":"tests/reproassert/test_issue_4074.py","sha256":"486a0d6ed030e197b4c59d18f23fa40ccd22c2fb82f77bbabc040e2220aba6c3","target":"tests/reproassert/test_issue_4074.py::test_issue_4074_reproduction"},"candidate_profile":{"command_profile":"pytest-v1","profile_id":"pytest-v1","profile_sha256":"a10033c7cc550587f343cde0a70c20a891eb59b4bbb8af591235e5382e010998","required_function":"test_issue_4074_reproduction","staging_path":"tests/reproassert/test_issue_4074.py","staging_path_sha256":"cbc2ac5f607909935c2c9f7055a042e8aff769a86dcf3b5cd62d4a9e69d77af7"},"case_id":"rk-v0.2-011","causal_controls":{"candidate_on_fixed":"fail","l2_causal_controls_passed":false,"remaining_required_controls":["fix_minus_issue_relevant_hunks","base_plus_issue_relevant_hunks"],"semantic_review_required":true},"claims":{"hidden_bytes_emitted":false,"model_or_provider_invoked":false,"network_during_sandbox_execution":false,"provider_calls":0},"evaluator_wall_ms":112039,"executed_at":"2026-07-12T17:32:41Z","inputs":{"algorithm":"reproassert-v02-exact-image-evaluator-capability-v2","benchmark_amendment_receipt_sha256":"bea6da1e7964a95814e0964acdccb555943e5f935bfab0c538a1eb594a35558e","benchmark_amendment_review_status":"pending","case_id":"rk-v0.2-011","evaluator_public_commitment_sha256":"05895c7c226e506f0c05ba49740995d768b41c0c41309867592cea89bdfdb235","gold_smoke":{"case_classification":"semantic_valid","case_reason":"fails_on_base_passes_on_fixed","receipt_commitment_sha256":"bb3a2dbb80b2972053cae576764d483c7ba1895c308282d3fad87d2154ce2647","receipt_sha256":"28c934c13f6daca4979b2c550e20cd43b5223aa90f9266ea4489c5a58b3e8993"},"hidden_inputs":{"developer_tests_bytes":1258,"developer_tests_sha256":"ac49c8fe1085bfb95c0d5df8e513f7a0fa9299c9f18ce878be2362e08797517b","hidden_extraction_receipt_sha256":"877287f73bbdced4f219451dd008d3fa0a5366f1d14826a2038eb00285eb14ef","production_patch_bytes":823,"production_patch_sha256":"643f8e9f14148cb48741a09de7c02ec50175a2a63d8bef84821ad6ab12c4b141"},"runtime":{"base_sha":"19b088636eb7d3f65ab7a1046ac672e0689371d8","base_tree_oid":"3bf98cbdbbae631df845ad6b3d3df31beb0cb40f","case_id":"rk-v0.2-011","image_digest":"sha256:4698f9b10798924dc761305a938f0c9baa3e124c541678fb9b58a62a1079b678","image_id":"sha256:4698f9b10798924dc761305a938f0c9baa3e124c541678fb9b58a62a1079b678","image_tag":"swebench/sweb.eval.x86_64.pydata_1776_xarray-4075:v1","instance_id":"pydata__xarray-4075","spec_sha256":"97946b31905c0cc9b9d78a9edeb5939d695c56ba942e9e6c0c1dd48ab0bdfb31","test_command_profile":"pytest-v1"},"runtime_manifest_sha256":"385e546661f172b6f9facd9aa2c20a2f1996623af7fc85a09ad60dc9f4f0b930"},"outcome":{"accepted":false,"base_consistency":"3/3","classification":"wrong_or_flaky_failure","fixed_consistency":"3/3","reason":"Base runs did not preserve one normalized failure fingerprint."},"phases":{"candidate_runs":[{"collection":{"exit_code":0,"junit_sha256":null,"oom_killed":false,"output_bytes":2153,"output_sha256":"ec2458d4b73337fb1d8f42af7d3c5684f46af7e8b159a816c89eff7771052c9b","output_stored":false,"output_truncated":false,"timed_out":false},"failure_fingerprint_sha256":null,"result":{"exit_code":1,"junit_sha256":null,"oom_killed":false,"output_bytes":3304,"output_sha256":"8ccba9380228416474d8d3f7025389ec3d1a697fe0a076b2f6aa7218beac7c26","output_stored":false,"output_truncated":false,"timed_out":false},"workspace":"base"},{"collection":{"exit_code":0,"junit_sha256":null,"oom_killed":false,"output_bytes":2153,"output_sha256":"c73f12be9217083fec7e324069c3cd52129e82eb16237ec12469f64c72a4d06f","output_stored":false,"output_truncated":false,"timed_out":false},"failure_fingerprint_sha256":null,"result":{"exit_code":0,"junit_sha256":null,"oom_killed":false,"output_bytes":2226,"output_sha256":"a375eb863dc189b3b15b8b78d0e088b2f9238a69f87c03c0c45ccf46fe9c07af","output_stored":false,"output_truncated":false,"timed_out":false},"workspace":"fixed"},{"collection":{"exit_code":0,"junit_sha256":null,"oom_killed":false,"output_bytes":2153,"output_sha256":"6edbddedcd5e02f6f4bf79acb624960283fccfec204feb4cb1331877175cffc3","output_stored":false,"output_truncated":false,"timed_out":false},"failure_fingerprint_sha256":null,"result":{"exit_code":0,"junit_sha256":null,"oom_killed":false,"output_bytes":2226,"output_sha256":"f8ca0d5febf9cb96fafdbb4d9f791e5f1fba16bda31ce3972018b299d18979a4","output_stored":false,"output_truncated":false,"timed_out":false},"workspace":"fixed"},{"collection":{"exit_code":0,"junit_sha256":null,"oom_killed":false,"output_bytes":2153,"output_sha256":"8bd152ba8ff0458a829638e03579a7dc3466e6cca2c9249fae1022fe4cc96a36","output_stored":false,"output_truncated":false,"timed_out":false},"failure_fingerprint_sha256":null,"result":{"exit_code":1,"junit_sha256":null,"oom_killed":false,"output_bytes":3304,"output_sha256":"9437e7aad22a79c58c2802dc6deda15186ee2c011a3cfadd8be43a8478dfd252","output_stored":false,"output_truncated":false,"timed_out":false},"workspace":"base"},{"collection":{"exit_code":0,"junit_sha256":null,"oom_killed":false,"output_bytes":2153,"output_sha256":"dc2fcdc7dcfb252d341e7781b4720ee9bf9cfb3c7035034baaa3d706752fb2cb","output_stored":false,"output_truncated":false,"timed_out":false},"failure_fingerprint_sha256":null,"result":{"exit_code":1,"junit_sha256":null,"oom_killed":false,"output_bytes":3304,"output_sha256":"05575442dc1968c9c07036bc7c41f2c5f4f0b30b8fcbd974a18c5536ec2c89c6","output_stored":false,"output_truncated":false,"timed_out":false},"workspace":"base"},{"collection":{"exit_code":0,"junit_sha256":null,"oom_killed":false,"output_bytes":2153,"output_sha256":"8495a734754c1d95e5e5161d397805be807d595a764c55a37030d1b00e4dea10","output_stored":false,"output_truncated":false,"timed_out":false},"failure_fingerprint_sha256":null,"result":{"exit_code":0,"junit_sha256":null,"oom_killed":false,"output_bytes":2226,"output_sha256":"d61ded16d0e1d2b9856cc42a15ba77dc442d0c410dfc819a165de7cc84fd588a","output_stored":false,"output_truncated":false,"timed_out":false},"workspace":"fixed"}],"gold_base":{"exit_code":1,"junit_sha256":null,"oom_killed":false,"output_bytes":3909,"output_sha256":"8ac0e6e33a4922910c13d885c290c721cfd37caf45b27afefcac629b346b330e","output_stored":false,"output_truncated":false,"timed_out":false},"gold_base_collect":{"exit_code":0,"junit_sha256":null,"oom_killed":false,"output_bytes":2431,"output_sha256":"9f17fb76b3028d0074e0957335cddda2e4af00db5bed73e1927196e4f2f7cff0","output_stored":false,"output_truncated":false,"timed_out":false},"gold_fixed":{"exit_code":0,"junit_sha256":null,"oom_killed":false,"output_bytes":2379,"output_sha256":"acea079076a5cf307e481a39bf1e66873fd394c8ed48a6f4e67fa50b9fff90b9","output_stored":false,"output_truncated":false,"timed_out":false},"gold_fixed_collect":{"exit_code":0,"junit_sha256":null,"oom_killed":false,"output_bytes":2431,"output_sha256":"9e458bc65e15917a717b1ea4a044c98bad307afae8c31c069a10cb9be968beb7","output_stored":false,"output_truncated":false,"timed_out":false}},"policy":{"base_runs":3,"fixed_runs":3,"profile":"reproassert-v02-instance-candidate-evaluation-resources-v1","sandbox":{"capabilities":"drop_all","network_mode":"none","no_new_privileges":true,"read_only_root":true,"test_user":"65532:65532"}},"receipt_sha256":"fe1ec497c145c58abcb0699cb39422bcdcee5b1ade63a65db9b27e9138a9a584","schema_version":"1.0.0","tool_git_sha":"d1905a25c93034fcfbc580a63e333026484ec959"}
