{"algorithm":"reproassert-v02-instance-candidate-evaluation-v1","benchmark_version":"0.2","candidate":{"bytes":586,"relative_path":"tests/reproassert/test_issue_12906.py","sha256":"e7f312f8994a8c11c984e094ac4f6e70f83854e1643c4ef95e864592fdcceda7","target":"tests/reproassert/test_issue_12906.py::test_issue_12906_reproduction"},"candidate_profile":{"command_profile":"pytest-v1","profile_id":"pytest-v1","profile_sha256":"1ba7f0b668f0c8bb8dbcf549845d420831aca3044d73f95a2f37a768018f800c","required_function":"test_issue_12906_reproduction","staging_path":"tests/reproassert/test_issue_12906.py","staging_path_sha256":"fedc88052b27df3e667877e07f1c7e7886e04d1e8db229e8113d9a8d0dc113c0"},"case_id":"rk-v0.2-003","causal_controls":{"candidate_on_fixed":"fail","l2_causal_controls_passed":false,"remaining_required_controls":["fix_minus_issue_relevant_hunks","base_plus_issue_relevant_hunks"],"semantic_review_required":true},"claims":{"hidden_bytes_emitted":false,"model_or_provider_invoked":false,"network_during_sandbox_execution":false,"provider_calls":0},"evaluator_wall_ms":75652,"executed_at":"2026-07-12T17:32:41Z","inputs":{"algorithm":"reproassert-v02-exact-image-evaluator-capability-v2","benchmark_amendment_receipt_sha256":"bea6da1e7964a95814e0964acdccb555943e5f935bfab0c538a1eb594a35558e","benchmark_amendment_review_status":"pending","case_id":"rk-v0.2-003","evaluator_public_commitment_sha256":"f8712201a3c02ffa7039d83d271fbc3e91f1ca1ddb071c2f5ef2234b729cb229","gold_smoke":{"case_classification":"semantic_valid","case_reason":"fails_on_base_passes_on_fixed","receipt_commitment_sha256":"bb3a2dbb80b2972053cae576764d483c7ba1895c308282d3fad87d2154ce2647","receipt_sha256":"28c934c13f6daca4979b2c550e20cd43b5223aa90f9266ea4489c5a58b3e8993"},"hidden_inputs":{"developer_tests_bytes":1415,"developer_tests_sha256":"5ef90b640ffce4590bb61ef2ea0e3256416dddf41b45bf4f2c3610a6e8c53718","hidden_extraction_receipt_sha256":"877287f73bbdced4f219451dd008d3fa0a5366f1d14826a2038eb00285eb14ef","production_patch_bytes":470,"production_patch_sha256":"0f3e44432ed8540e9526edff4f83793948a2f139fc3971b67c30043c1eb7964a"},"runtime":{"base_sha":"d16bfe05a744909de4b27f5875fe0d4ed41ce607","base_tree_oid":"4d9ea46e57a9bc539b358a59c526dfd933f98aba","case_id":"rk-v0.2-003","image_digest":"sha256:0409bc2843724ebb54401bfe3f1577c52cc6dc4b5ede88571fd90e3ac7c52b6d","image_id":"sha256:0409bc2843724ebb54401bfe3f1577c52cc6dc4b5ede88571fd90e3ac7c52b6d","image_tag":"swebench/sweb.eval.x86_64.astropy_1776_astropy-12907:v1","instance_id":"astropy__astropy-12907","spec_sha256":"08e9a6c3ba08e96937af1fbb273c51ab546d7bb5263a8d793366d434584ed0a1","test_command_profile":"pytest-v1"},"runtime_manifest_sha256":"385e546661f172b6f9facd9aa2c20a2f1996623af7fc85a09ad60dc9f4f0b930"},"outcome":{"accepted":false,"base_consistency":"3/3","classification":"wrong_or_flaky_failure","fixed_consistency":"3/3","reason":"Base runs did not preserve one normalized failure fingerprint."},"phases":{"candidate_runs":[{"collection":{"exit_code":0,"junit_sha256":null,"oom_killed":false,"output_bytes":1365,"output_sha256":"3a0d68fd38db7d3add720fb56c5ddfe33a8919215eaf0901b98f0e2fac9a6062","output_stored":false,"output_truncated":false,"timed_out":false},"failure_fingerprint_sha256":null,"result":{"exit_code":1,"junit_sha256":null,"oom_killed":false,"output_bytes":2915,"output_sha256":"82c96df108582449de3578c09029c4c59ced5d47ccc1b7a241a907832781b298","output_stored":false,"output_truncated":false,"timed_out":false},"workspace":"base"},{"collection":{"exit_code":0,"junit_sha256":null,"oom_killed":false,"output_bytes":1365,"output_sha256":"27bd08f07233a6229474364c7925ec3e353a38ce2e1f58cdb92977ba662a5e72","output_stored":false,"output_truncated":false,"timed_out":false},"failure_fingerprint_sha256":null,"result":{"exit_code":0,"junit_sha256":null,"oom_killed":false,"output_bytes":1436,"output_sha256":"29eb0d73f380ee6b53d8f8078de37824ac2f82c8fcfd6b9ab895ba00d02fa492","output_stored":false,"output_truncated":false,"timed_out":false},"workspace":"fixed"},{"collection":{"exit_code":0,"junit_sha256":null,"oom_killed":false,"output_bytes":1365,"output_sha256":"4a4af0d86288ad16b0537795edcef6b033c1ad7d74cca872fc84a1423db6e4e9","output_stored":false,"output_truncated":false,"timed_out":false},"failure_fingerprint_sha256":null,"result":{"exit_code":0,"junit_sha256":null,"oom_killed":false,"output_bytes":1436,"output_sha256":"b821394c018f6af144246c8630ee2a01871f96961cfb7ecb8f2fa498e00942fd","output_stored":false,"output_truncated":false,"timed_out":false},"workspace":"fixed"},{"collection":{"exit_code":0,"junit_sha256":null,"oom_killed":false,"output_bytes":1365,"output_sha256":"6ea3825de83a365fcdcfcf6fdd6ae268f536bc60f6736ffdabd99992764d5391","output_stored":false,"output_truncated":false,"timed_out":false},"failure_fingerprint_sha256":null,"result":{"exit_code":1,"junit_sha256":null,"oom_killed":false,"output_bytes":2915,"output_sha256":"273b6da68cd09267b5adfc3046e1b02ffb9dd2051c633dc3df81de3fbd563794","output_stored":false,"output_truncated":false,"timed_out":false},"workspace":"base"},{"collection":{"exit_code":0,"junit_sha256":null,"oom_killed":false,"output_bytes":1365,"output_sha256":"b259f2cc4e4ed25c00c0086d78e36db9557062a55511fc82d0e84d982d59b669","output_stored":false,"output_truncated":false,"timed_out":false},"failure_fingerprint_sha256":null,"result":{"exit_code":1,"junit_sha256":null,"oom_killed":false,"output_bytes":2915,"output_sha256":"0497ba1214fd840816a01d60721ff00219b9b1c517d4351373dfadc2a4d60aed","output_stored":false,"output_truncated":false,"timed_out":false},"workspace":"base"},{"collection":{"exit_code":0,"junit_sha256":null,"oom_killed":false,"output_bytes":1365,"output_sha256":"bbadbcc89cea1995a29977ed63540d6c2d04845ef4e9c21eb6c086dc230f0890","output_stored":false,"output_truncated":false,"timed_out":false},"failure_fingerprint_sha256":null,"result":{"exit_code":0,"junit_sha256":null,"oom_killed":false,"output_bytes":1436,"output_sha256":"fae0b77a797196f35c769ce9e6a720a8a4097e491e07db53259d4c0a88c44330","output_stored":false,"output_truncated":false,"timed_out":false},"workspace":"fixed"}],"gold_base":{"exit_code":1,"junit_sha256":null,"oom_killed":false,"output_bytes":4811,"output_sha256":"5bcb60c6db05174549a742c5fe278beb408eb8aefcbaa592b7ae90aa9fad5e98","output_stored":false,"output_truncated":false,"timed_out":false},"gold_base_collect":{"exit_code":0,"junit_sha256":null,"oom_killed":false,"output_bytes":1691,"output_sha256":"5eca736276a5b56b31dbb779a26582c5894ce1de2c09f7afc7b737e3ab1614ac","output_stored":false,"output_truncated":false,"timed_out":false},"gold_fixed":{"exit_code":0,"junit_sha256":null,"oom_killed":false,"output_bytes":1615,"output_sha256":"7c6d9f67c1dd433d03459a5fc6fda1b6efcdf017928e50e04fda8dfe8189e1bd","output_stored":false,"output_truncated":false,"timed_out":false},"gold_fixed_collect":{"exit_code":0,"junit_sha256":null,"oom_killed":false,"output_bytes":1691,"output_sha256":"a2c3ce7be72ce8f504797ed819348c17d2430ba4c8ccd818e3cdec535ff78b3d","output_stored":false,"output_truncated":false,"timed_out":false}},"policy":{"base_runs":3,"fixed_runs":3,"profile":"reproassert-v02-instance-candidate-evaluation-resources-v1","sandbox":{"capabilities":"drop_all","network_mode":"none","no_new_privileges":true,"read_only_root":true,"test_user":"65532:65532"}},"receipt_sha256":"9450210d75acf439f915b2b406ae4f40d8493260954d4c117bf345bf4575ccac","schema_version":"1.0.0","tool_git_sha":"d1905a25c93034fcfbc580a63e333026484ec959"}
