{"algorithm":"reproassert-v02-instance-candidate-evaluation-v1","benchmark_version":"0.2","candidate":{"bytes":430,"relative_path":"tests/reproassert/test_issue_13314.py","sha256":"ab60435aef0fe6a20b3b0d103baa7c7ba8c899db8c994cd9a385e11aae3e0b8e","target":"tests/reproassert/test_issue_13314.py::test_issue_13314_reproduction"},"candidate_profile":{"command_profile":"pytest-v1","profile_id":"pytest-v1","profile_sha256":"c60166426bcf1645e8659959237185a504c8cde8e7b28dc22ea6cc89544c4bd2","required_function":"test_issue_13314_reproduction","staging_path":"tests/reproassert/test_issue_13314.py","staging_path_sha256":"d76090fa22993f704b9f5b6314c6d723d5c7f37c56b46d5684f5bd90a03687bf"},"case_id":"rk-v0.2-007","causal_controls":{"candidate_on_fixed":"fail","l2_causal_controls_passed":false,"remaining_required_controls":["fix_minus_issue_relevant_hunks","base_plus_issue_relevant_hunks"],"semantic_review_required":true},"claims":{"hidden_bytes_emitted":false,"model_or_provider_invoked":false,"network_during_sandbox_execution":false,"provider_calls":0},"evaluator_wall_ms":78099,"executed_at":"2026-07-12T17:32:41Z","inputs":{"algorithm":"reproassert-v02-exact-image-evaluator-capability-v2","benchmark_amendment_receipt_sha256":"bea6da1e7964a95814e0964acdccb555943e5f935bfab0c538a1eb594a35558e","benchmark_amendment_review_status":"pending","case_id":"rk-v0.2-007","evaluator_public_commitment_sha256":"0bc3b4480f774ef705289fd1432d911fb3b174e408cb87244e2c5a43d37b7dd8","gold_smoke":{"case_classification":"semantic_valid","case_reason":"fails_on_base_passes_on_fixed","receipt_commitment_sha256":"bb3a2dbb80b2972053cae576764d483c7ba1895c308282d3fad87d2154ce2647","receipt_sha256":"28c934c13f6daca4979b2c550e20cd43b5223aa90f9266ea4489c5a58b3e8993"},"hidden_inputs":{"developer_tests_bytes":2908,"developer_tests_sha256":"ea0bc13b412ab4f474800827ddd44eddb8ab926782c7a143c330cb84effeec95","hidden_extraction_receipt_sha256":"877287f73bbdced4f219451dd008d3fa0a5366f1d14826a2038eb00285eb14ef","production_patch_bytes":603,"production_patch_sha256":"4d43cadc3e1bd7101beadddb99609e524b44d28394286e7bca67692cd4a14d68"},"runtime":{"base_sha":"37b0e66c871e8fb032a9c7086b2a1d5419838154","base_tree_oid":"db78dd3cfd247d5ee956ade98032b830e5776205","case_id":"rk-v0.2-007","image_digest":"sha256:f4381d5b9270261513d140d2d2815fd7990cea694e5b2151ca114dead149ee38","image_id":"sha256:f4381d5b9270261513d140d2d2815fd7990cea694e5b2151ca114dead149ee38","image_tag":"swebench/sweb.eval.x86_64.scikit-learn_1776_scikit-learn-13328:v1","instance_id":"scikit-learn__scikit-learn-13328","spec_sha256":"d065dbafbbf3e60b5b075850505f19c1b97540ab216ed16f9463b0207d4bd4db","test_command_profile":"pytest-v1"},"runtime_manifest_sha256":"385e546661f172b6f9facd9aa2c20a2f1996623af7fc85a09ad60dc9f4f0b930"},"outcome":{"accepted":false,"base_consistency":"3/3","classification":"wrong_or_flaky_failure","fixed_consistency":"3/3","reason":"Base runs did not preserve one normalized failure fingerprint."},"phases":{"candidate_runs":[{"collection":{"exit_code":0,"junit_sha256":null,"oom_killed":false,"output_bytes":386,"output_sha256":"e248ef31c530041ec10d99210f6beb5952d7549e8ae0d5d9dd99687a7dc7023d","output_stored":false,"output_truncated":false,"timed_out":false},"failure_fingerprint_sha256":null,"result":{"exit_code":1,"junit_sha256":null,"oom_killed":false,"output_bytes":6225,"output_sha256":"2789137ce418afe8ad42b214f059ec7b13ad78a8b675227c7fc02eacf61b4405","output_stored":false,"output_truncated":false,"timed_out":false},"workspace":"base"},{"collection":{"exit_code":0,"junit_sha256":null,"oom_killed":false,"output_bytes":386,"output_sha256":"650ea54934287daa8ffcb938cd834ce147bff75c893e8a2ef29446c1d70b0ca2","output_stored":false,"output_truncated":false,"timed_out":false},"failure_fingerprint_sha256":null,"result":{"exit_code":0,"junit_sha256":null,"oom_killed":false,"output_bytes":457,"output_sha256":"b06d168c9c5ab3d0bfdb9308e82cda0a952847425bd22884847032701309d13d","output_stored":false,"output_truncated":false,"timed_out":false},"workspace":"fixed"},{"collection":{"exit_code":0,"junit_sha256":null,"oom_killed":false,"output_bytes":386,"output_sha256":"2930b564452d1a6720413fe62edcdd49702ccd111e0671167c491ad2e137c00c","output_stored":false,"output_truncated":false,"timed_out":false},"failure_fingerprint_sha256":null,"result":{"exit_code":0,"junit_sha256":null,"oom_killed":false,"output_bytes":457,"output_sha256":"b4ac770f9a3d126cdb33521e8829457e0a1b40255a6a9965409fdc8ded9ba6a0","output_stored":false,"output_truncated":false,"timed_out":false},"workspace":"fixed"},{"collection":{"exit_code":0,"junit_sha256":null,"oom_killed":false,"output_bytes":386,"output_sha256":"bb9ec6128eb8f940f89c0fce8606b57285a70e9dc6c14b2456385208de0e8ea5","output_stored":false,"output_truncated":false,"timed_out":false},"failure_fingerprint_sha256":null,"result":{"exit_code":1,"junit_sha256":null,"oom_killed":false,"output_bytes":6225,"output_sha256":"efa94dc191ecdfb42ce4e058c1c5ef271beabbdeaff8ce16507326c5013b8333","output_stored":false,"output_truncated":false,"timed_out":false},"workspace":"base"},{"collection":{"exit_code":0,"junit_sha256":null,"oom_killed":false,"output_bytes":386,"output_sha256":"051032466e226d4ad1ee27f5fd7cb4cd548aa9901ad12b1ffc08bd31f3afb824","output_stored":false,"output_truncated":false,"timed_out":false},"failure_fingerprint_sha256":null,"result":{"exit_code":1,"junit_sha256":null,"oom_killed":false,"output_bytes":6225,"output_sha256":"6da6c4a885ab778c441ba133a64705af834481aff6cc10306248f771b5ee1608","output_stored":false,"output_truncated":false,"timed_out":false},"workspace":"base"},{"collection":{"exit_code":0,"junit_sha256":null,"oom_killed":false,"output_bytes":386,"output_sha256":"9ae56842b61d10b49bf363f7cebedfe73c15d5fc70de397afc27bd9a5a296981","output_stored":false,"output_truncated":false,"timed_out":false},"failure_fingerprint_sha256":null,"result":{"exit_code":0,"junit_sha256":null,"oom_killed":false,"output_bytes":457,"output_sha256":"69227c6e2315d916b5e7f860fdec606bc1b6d53ef2fd055fba751acd2c037645","output_stored":false,"output_truncated":false,"timed_out":false},"workspace":"fixed"}],"gold_base":{"exit_code":1,"junit_sha256":null,"oom_killed":false,"output_bytes":6334,"output_sha256":"befec674712328f0267412bfff3d77371193ac4c63446ec65279e70903957469","output_stored":false,"output_truncated":false,"timed_out":false},"gold_base_collect":{"exit_code":0,"junit_sha256":null,"oom_killed":false,"output_bytes":375,"output_sha256":"83a57273aa9ce0755c4aa8bd01760e741f1d4179c7db7c19b3c2cd053872b197","output_stored":false,"output_truncated":false,"timed_out":false},"gold_fixed":{"exit_code":0,"junit_sha256":null,"oom_killed":false,"output_bytes":376,"output_sha256":"589c38337ef178d8ffd8d047b1fe43d349ab19652b3ce808e742defcdf1320aa","output_stored":false,"output_truncated":false,"timed_out":false},"gold_fixed_collect":{"exit_code":0,"junit_sha256":null,"oom_killed":false,"output_bytes":375,"output_sha256":"0b54980b6a7d371220219964732b4ac26847de996f79301efd68cd7188ba437d","output_stored":false,"output_truncated":false,"timed_out":false}},"policy":{"base_runs":3,"fixed_runs":3,"profile":"reproassert-v02-instance-candidate-evaluation-resources-v1","sandbox":{"capabilities":"drop_all","network_mode":"none","no_new_privileges":true,"read_only_root":true,"test_user":"65532:65532"}},"receipt_sha256":"667fb6871f6da001fe311ed2f9576e8761a72d4a75f9c8339da1535860b7cd77","schema_version":"1.0.0","tool_git_sha":"d1905a25c93034fcfbc580a63e333026484ec959"}
